{
  "schema_version": "0.1",
  "curriculum_id": "ko.curriculum.mathematics-v0.1",
  "curriculum_version": "0.1",
  "mathematics_version": "Mathematics V0.1",
  "subject": "Mathematics",
  "title": "Mathematics V0.1 Golden Reference Curriculum",
  "description": "A bounded, auditable curriculum path with one stage per atomic discipline. Chapters, topics, concepts, skills, prerequisites, and assessments are declared in each stage title and expanded as structured dataset targets.",
  "root_node_ids": [
    "ko.math.v0.1.math"
  ],
  "atomic_discipline_ids": [
    "ko.math.v0.1.ad.algebra.linear-algebra.vector-spaces-linear-maps",
    "ko.math.v0.1.ad.algebra.linear-algebra.matrix-theory",
    "ko.math.v0.1.ad.algebra.linear-algebra.linear-systems",
    "ko.math.v0.1.ad.algebra.number-theory.elementary-number-theory",
    "ko.math.v0.1.ad.algebra.number-theory.algebraic-number-theory",
    "ko.math.v0.1.ad.algebra.number-theory.analytic-number-theory",
    "ko.math.v0.1.ad.algebra.number-theory.diophantine-equations",
    "ko.math.v0.1.ad.analysis.calculus.differential-calculus",
    "ko.math.v0.1.ad.analysis.calculus.integral-calculus",
    "ko.math.v0.1.ad.analysis.calculus.multivariable-calculus",
    "ko.math.v0.1.ad.analysis.calculus.vector-calculus",
    "ko.math.v0.1.ad.probability-statistics.probability.probability-foundations",
    "ko.math.v0.1.ad.probability-statistics.probability.random-variables-distributions",
    "ko.math.v0.1.ad.probability-statistics.probability.stochastic-processes",
    "ko.math.v0.1.ad.probability-statistics.statistics.statistical-inference",
    "ko.math.v0.1.ad.probability-statistics.statistics.regression-analysis",
    "ko.math.v0.1.ad.probability-statistics.statistics.experimental-design",
    "ko.math.v0.1.ad.probability-statistics.statistics.bayesian-statistics",
    "ko.math.v0.1.ad.discrete-mathematics.combinatorics.enumerative-combinatorics",
    "ko.math.v0.1.ad.discrete-mathematics.combinatorics.extremal-combinatorics",
    "ko.math.v0.1.ad.discrete-mathematics.graph-theory.structural-graph-theory",
    "ko.math.v0.1.ad.discrete-mathematics.graph-theory.graph-algorithms",
    "ko.math.v0.1.ad.discrete-mathematics.mathematical-logic.set-theory",
    "ko.math.v0.1.ad.discrete-mathematics.mathematical-logic.computability-theory",
    "ko.math.v0.1.ad.discrete-mathematics.mathematical-logic.proof-theory",
    "ko.math.v0.1.ad.geometry.euclidean-geometry.classical-euclidean-geometry",
    "ko.math.v0.1.ad.geometry.analytic-geometry.coordinate-geometry",
    "ko.math.v0.1.ad.geometry.differential-geometry.curves-and-surfaces"
  ],
  "stages": [
    {
      "stage_id": "ko.curriculum.mathematics-v0.1.stage.algebra.linear-algebra.vector-spaces-linear-maps",
      "sequence": 0,
      "title": "Chapter: Algebra | Topic: Vector Spaces and Linear Maps | Concepts: Vector spaces, Linear transformations, Dimension and rank | Skills: identify the boundary; explain the central objects; classify a representative problem | Prerequisites: entry level for this atomic discipline | Assessment: one independent boundary-and-explanation item",
      "node_ids": [
        "ko.math.v0.1.math",
        "ko.math.v0.1.algebra",
        "ko.math.v0.1.algebra.linear-algebra",
        "ko.math.v0.1.algebra.linear-algebra.vector-spaces-linear-maps"
      ],
      "atomic_discipline_ids": [
        "ko.math.v0.1.ad.algebra.linear-algebra.vector-spaces-linear-maps"
      ],
      "prerequisite_stage_ids": [],
      "review_state": "machine_validated"
    },
    {
      "stage_id": "ko.curriculum.mathematics-v0.1.stage.algebra.linear-algebra.matrix-theory",
      "sequence": 1,
      "title": "Chapter: Algebra | Topic: Matrix Theory | Concepts: Matrix operations, Eigenvalues and eigenvectors, Canonical forms | Skills: identify the boundary; explain the central objects; classify a representative problem | Prerequisites: Vector Spaces and Linear Maps | Assessment: one independent boundary-and-explanation item",
      "node_ids": [
        "ko.math.v0.1.math",
        "ko.math.v0.1.algebra",
        "ko.math.v0.1.algebra.linear-algebra",
        "ko.math.v0.1.algebra.linear-algebra.matrix-theory"
      ],
      "atomic_discipline_ids": [
        "ko.math.v0.1.ad.algebra.linear-algebra.matrix-theory"
      ],
      "prerequisite_stage_ids": [
        "ko.curriculum.mathematics-v0.1.stage.algebra.linear-algebra.vector-spaces-linear-maps"
      ],
      "review_state": "machine_validated"
    },
    {
      "stage_id": "ko.curriculum.mathematics-v0.1.stage.algebra.linear-algebra.linear-systems",
      "sequence": 2,
      "title": "Chapter: Algebra | Topic: Linear Systems | Concepts: Linear equations, Rank and solvability, Solution spaces | Skills: identify the boundary; explain the central objects; classify a representative problem | Prerequisites: Vector Spaces and Linear Maps; Matrix Theory | Assessment: one independent boundary-and-explanation item",
      "node_ids": [
        "ko.math.v0.1.math",
        "ko.math.v0.1.algebra",
        "ko.math.v0.1.algebra.linear-algebra",
        "ko.math.v0.1.algebra.linear-algebra.linear-systems"
      ],
      "atomic_discipline_ids": [
        "ko.math.v0.1.ad.algebra.linear-algebra.linear-systems"
      ],
      "prerequisite_stage_ids": [
        "ko.curriculum.mathematics-v0.1.stage.algebra.linear-algebra.vector-spaces-linear-maps",
        "ko.curriculum.mathematics-v0.1.stage.algebra.linear-algebra.matrix-theory"
      ],
      "review_state": "machine_validated"
    },
    {
      "stage_id": "ko.curriculum.mathematics-v0.1.stage.algebra.number-theory.elementary-number-theory",
      "sequence": 3,
      "title": "Chapter: Algebra | Topic: Elementary Number Theory | Concepts: Divisibility, Congruences, Prime numbers | Skills: identify the boundary; explain the central objects; classify a representative problem | Prerequisites: entry level for this atomic discipline | Assessment: one independent boundary-and-explanation item",
      "node_ids": [
        "ko.math.v0.1.math",
        "ko.math.v0.1.algebra",
        "ko.math.v0.1.algebra.number-theory",
        "ko.math.v0.1.algebra.number-theory.elementary-number-theory"
      ],
      "atomic_discipline_ids": [
        "ko.math.v0.1.ad.algebra.number-theory.elementary-number-theory"
      ],
      "prerequisite_stage_ids": [],
      "review_state": "machine_validated"
    },
    {
      "stage_id": "ko.curriculum.mathematics-v0.1.stage.algebra.number-theory.algebraic-number-theory",
      "sequence": 4,
      "title": "Chapter: Algebra | Topic: Algebraic Number Theory | Concepts: Number fields, Ideals, Algebraic integers | Skills: identify the boundary; explain the central objects; classify a representative problem | Prerequisites: Elementary Number Theory | Assessment: one independent boundary-and-explanation item",
      "node_ids": [
        "ko.math.v0.1.math",
        "ko.math.v0.1.algebra",
        "ko.math.v0.1.algebra.number-theory",
        "ko.math.v0.1.algebra.number-theory.algebraic-number-theory"
      ],
      "atomic_discipline_ids": [
        "ko.math.v0.1.ad.algebra.number-theory.algebraic-number-theory"
      ],
      "prerequisite_stage_ids": [
        "ko.curriculum.mathematics-v0.1.stage.algebra.number-theory.elementary-number-theory"
      ],
      "review_state": "machine_validated"
    },
    {
      "stage_id": "ko.curriculum.mathematics-v0.1.stage.algebra.number-theory.analytic-number-theory",
      "sequence": 5,
      "title": "Chapter: Algebra | Topic: Analytic Number Theory | Concepts: Prime distribution, Dirichlet series, Asymptotic number theory | Skills: identify the boundary; explain the central objects; classify a representative problem | Prerequisites: Elementary Number Theory | Assessment: one independent boundary-and-explanation item",
      "node_ids": [
        "ko.math.v0.1.math",
        "ko.math.v0.1.algebra",
        "ko.math.v0.1.algebra.number-theory",
        "ko.math.v0.1.algebra.number-theory.analytic-number-theory"
      ],
      "atomic_discipline_ids": [
        "ko.math.v0.1.ad.algebra.number-theory.analytic-number-theory"
      ],
      "prerequisite_stage_ids": [
        "ko.curriculum.mathematics-v0.1.stage.algebra.number-theory.elementary-number-theory"
      ],
      "review_state": "machine_validated"
    },
    {
      "stage_id": "ko.curriculum.mathematics-v0.1.stage.algebra.number-theory.diophantine-equations",
      "sequence": 6,
      "title": "Chapter: Algebra | Topic: Diophantine Equations | Concepts: Integer solutions, Rational solutions, Arithmetic curves in elementary scope | Skills: identify the boundary; explain the central objects; classify a representative problem | Prerequisites: Elementary Number Theory | Assessment: one independent boundary-and-explanation item",
      "node_ids": [
        "ko.math.v0.1.math",
        "ko.math.v0.1.algebra",
        "ko.math.v0.1.algebra.number-theory",
        "ko.math.v0.1.algebra.number-theory.diophantine-equations"
      ],
      "atomic_discipline_ids": [
        "ko.math.v0.1.ad.algebra.number-theory.diophantine-equations"
      ],
      "prerequisite_stage_ids": [
        "ko.curriculum.mathematics-v0.1.stage.algebra.number-theory.elementary-number-theory"
      ],
      "review_state": "machine_validated"
    },
    {
      "stage_id": "ko.curriculum.mathematics-v0.1.stage.analysis.calculus.differential-calculus",
      "sequence": 7,
      "title": "Chapter: Analysis | Topic: Differential Calculus | Concepts: Derivatives, Differentiability, Taylor approximation | Skills: identify the boundary; explain the central objects; classify a representative problem | Prerequisites: entry level for this atomic discipline | Assessment: one independent boundary-and-explanation item",
      "node_ids": [
        "ko.math.v0.1.math",
        "ko.math.v0.1.analysis",
        "ko.math.v0.1.analysis.calculus",
        "ko.math.v0.1.analysis.calculus.differential-calculus"
      ],